,term,definition,break_down
828,Property Insurance,"Property insurance is a policy that provides financial reimbursement to the owner or renter of a structure and its contentsin the event of damage or theft. Property insurance can include homeowners insurance, renters insurance, flood insurance and earthquake insurance. Personal property is generally covered by a homeowners or renters policy, unless it is of particularly high value, in which case it can usually be covered by purchasing an addition to the policy called a ""rider.""If there's a claim, the property insurance policy will either reimburse the policyholder for the actual value of the damageor the replacement cost to remedy the damage.","Perils typically covered by property insurance include damage caused by fire, smoke, wind, hail, weight of ice and snow, lightning, theft and more. Property insurance also provides liability coverage in case someone other than the property owner or renter is injured while on the propertyand decides to sue."
829,Prospective Reinsurance,"Prospective reinsurance is areinsurance contract in which coverage is provided for future losses on insurable events. Prospective reinsurance differs from retroactive reinsurance, which covers losses from insurable events that may have occurred in the past.","Some reinsurance contracts contain both prospective and retroactive coverage because insurance companies have to account for two distinct types of risk. The first type of risk involves future events. The insurer has to consider the probability that a future event that is covered under a policy will result in a loss being reported. For example, that a fire will result in a loss on a fire insurance policy. The second type of risk is the liability associated with insurable events that have occurred in the past, and that a claim will be filed against the company in the future. As long as an insurance policy is active, it will be subject to claims until the premium has been fully earned."
830,Protected Cell Company (PCC),"A protected cell company(PCC) is acorporate structure in which a single legal entity is comprised of a core and several cells that have separate assets and liabilities. A PCC has a similar design to a hub and spoke, with the central core organization linked to individual cells. Each cell is independent of each other and of the companys core, but the entire unit is still a single legal entity. A PPC is sometimes referred to as asegregated portfolio company.","A protected cell company operates (PCC) with two distinct groups: a single core company and an unlimited number of cells. It is governed by a single board of directors, which is responsible for the management of the PCC as a whole. Each cell is managed by a committee or similar group, with authority to the committeegranted by the PCC board of directors. A PCC files a single annual return to regulators, though business and operational plans of each cell may still require individual review and approval by regulators."
831,Provincial Parental Insurance Plan - PPIP,"A Canadian tax deduction relating to taxes that are paid or payable on regular or self-employed income. The Provincial Parental Insurance Plan (PPIP) gives maternity, paternity, parental and adoption benefits to qualified persons. This aid is to support and encourage parents staying home with their children for the first year of the child's life. ","The province of Quebec has a different plan called the Quebec Parental Insurance Plan (QPIP). The plan is in place for the same reasons, but has differing rules, regulations and tax implications. "
832,Provisional Notice Of Cancellation (PNOC),"A provisional notice of cancellation is a means by which one participant in a reinsurance treaty can notify the other participants of their intention to withdraw from the treaty. This notice is used only for withdrawal from continuous reinsurance contracts, which are typically eligible for cancellation or renewal once a year.",A provisional notice of cancellation (PNOC) allows all parties to a continuous reinsurance treaty the periodic opportunity to assess the contract and either renew or withdraw from it. Most reinsurance arrangements allow for this assessment once a year. Both the reinsured entity and the reinsurer have the right to issue a PNOC. Doing so gives them a 90-day window in which they can formally cancel the contract.
833,Public Company,"A public company is a company that has issued securities through an initial public offering (IPO) and is traded on at least one stock exchange or inover-the-counter markets. Although a small percentage of shares may be initially floated to the public, becoming a public company allows the market to determine the value of the entire company through daily trading.","Public companies are publicly traded within the open market with shares being purchased by a variety of investors. Most public companies originated from private companies that, after meeting all regulatory requirements, opted to become public in an effort to raise large amounts of capital. Examples of public companies include Google Inc., F5 Networks Inc., Chevron Corporation, and Procter & Gamble Co."
834,Public Offering Price (POP),"The public offering price (POP) is the price at which new issues of stock are offered to the public by an underwriter.Because the goal of an initial public offering (IPO) is to raise money, underwriters must determine a public offering price that will be attractiveto investors. When underwriters determine the public offering price, they look at factors such as the strength of the company's financial statements, how profitable it is, public trends, growth rates and even investor confidence.","Investors and analysts sometimes use the POP price as a benchmark against which a stock's current price can be compared. If a company's share price rises significantly above its initial public offering price, the company is considered to be performing well. However, if the share price later dips below its initial public offering price, this is considered a sign that investors have lost confidence in the company's ability to create value."
835,Pure Risk,"Pure risk, also known as absolute risk, is a category of hazard in which the outcomes are aloss or no loss, and there is no opportunity for gain. Examples of pure risk situations include premature death, identity theft, and career-ending disabilities. There are products available to mitigate pure risk hazards, such as homeowners insurance, which helps protect homeowners against the destruction of their homes.","It is harmful when pure risk is presentand loss occurs. As a contrast to pure risk, the outcomes of speculative riskinclude loss, gain, or no change. There are three types of pure risk: personal, property, and liability. There are four mitigation methods available to limit potential hazards. These methods are reduction, avoidance, acceptance, and transference. The most common method of dealing with pure risk is to transfer it to an insurance company by purchasing insurance."
836,QSEHRA,"A Qualified Small Employer Health Reimbursement Arrangement (QSEHRA), also known as Small Business HRA, is an Affordable Care Act-compliant health coverage plan for businesses with fewer than 50 full-time-equivalent (FTE) employees. A QSEHRA allows companies to reimburse workers up to $4,950 per year for single coverage and up to $10,000 per year for family coverage, adjusted for inflation. Reimbursements may pay the premiums for health insurance purchased on the individual market and pay for qualified medical expenses. Employees must provide proof of their actual medical coststo receive reimbursement.","Employees not covered by a QSEHRA for a full year (e.g., mid-year hires) receive a prorated amount of the full-year maximum reimbursement amount. Depending on the reimbursement received, employees participating in a QSEHRA may receive a lower subsidy or no subsidy for their health insurance premiums."
837,Qualifying Event,"A qualifying event triggers changes in a policyholders insurance due to new life circumstances, such as the birth of a child, and can be made at any time during the calendar year and not solely during open enrollment periods.","A qualifying event serves as an exclusion to typical insurance contracts with durations of one year for individual policyholders. In the case of insurance offered through an employer, individuals choose the type of coverage they want during an open enrollment period. Once open enrollment is closed,the individual may no longer make changes to thetype of insurance coverage they selected unless a qualifying event occurs. In some cases, insurance companies may offer more than one open enrollment period, and certain states may have regulations requiring insurers to offer multiple open enrollment periods."
838,Quick Liquidity Ratio,"Quick liquidity ratio is thetotal amount of a companys quick assets divided by the sum of its net liabilities and its reinsurance liabilities. Quick assets are liquid assets such as cash, short-term investments, equities, and corporate and government bonds nearing maturity. The quick liquidity ratio shows the amount of liquid assets an insurance company can tap into on short notice.","Thequick liquidityratio, also known as theacid-test ratio, is a liquidity ratio that further refines the current ratio by measuring the level of the mostliquidcurrent assets available to cover current liabilities. The quick ratio is more conservative than the current ratio because it excludes inventory and other current assets, which generally are more difficult to turn into cash. A higher quick ratio means a more liquid current position."
839,Quota Share Treaty,"A quotashare treaty isapro rata reinsurance contract in which the insurer and reinsurer share premiums and losses according to a fixed percentage. Quota share reinsurance allows an insurer to retain some risk and premium, while sharing the rest with an insurer up to a predetermined maximum coverage.","When an insurance company underwrites a new policy, it is paid a premium by the policyholder, and in exchange, it agrees to indemnify the policyholder up to the coverage limit. The more policies that aninsurer underwrites, the more its liabilitieswill grow, and at some point, it will runout of capacity to underwrite any new policies. In order to free up capacity, the insurer can cede some of its liabilities to a reinsurer through a reinsurance treaty. In exchange for taking on an insurers liabilities, the reinsurer receives a portion of the policy premiums."
840,Rate On Line,"Rate on line (ROL) is the ratio of premium paid to loss recoverable in a reinsurance contract. Rate on linerepresents how much an insurer has to pay to obtain reinsurance coverage, with a higher ROL indicating that the insurer has to pay more for coverage. Rate on line is the inverse of a reinsurance contracts payback period.","Insurance companies use reinsurance in order to free up additional capacity to underwrite new policies by transferring some of their liabilities to reinsurers. In exchange for taking on some of an insurers liabilities, reinsurers receive a portion of the premium that insurers collect on the policies that they underwrite."
841,Re-Entry Term Insurance,"Re-entry term insurance is a type of life insurance contract that offers low rates for a fixed period, and which will continue to offer low rates if the policyholder passes periodic medical examinations. Re-entry term insurance first appearedduring the 1970's, in response to increased inflation and consumer demand for lower premium increases on standard term-life contracts.","Re-entry term insurance typically offers low premiums for the first several years. In many cases, the policies will not require the policyholder to take a physical examination during this period."
842,Re-Offer Price,"A re-offer price is theprice at which the underwriting syndicate of a debt issue resells the bonds or IPO securitiesto public investors. The syndicate will purchase the bonds for a specified amount from the issuing firm and re-offer the bonds or securities to the public, usually at a different price.","An underwriting investment bank may facilitate a debt issue by agreeing to purchase all of the bonds or securitiesfor a price below face value. Having the underwriters purchase the bond issue, instead of passing the sale onto the public, removes the company's risk of not selling the entire issue. The investment banker will re-offer the bonds to public investors at a higher price, which may be above (premium) slightly below (discount) par value. In a serial issue, most common to municipal general obligation bonds, the first bonds to mature are frequently at a premium with a higher coupon rate. The last bonds to mature in the offering are sometimes sold at a discount, but carry a lower coupon rate."
843,Reallowance,A reallowance is a fee paidto a securities firm which is not part of theunderwriting syndicatebringing a new offering to the market. Theunderwriting grouppays thereallowancefee.The fee provides an incentive to broker-dealer firms to sell shares of the new issue to its client base. The amount of thereallowanceis typically a percentage of the underwriting spread.,"Most often, areallowance happens when there isuncertain investor demand. The underwriting syndicate may wish to enlist an additional broker's to increase demand in the underlying shares of the new issue. The underwriting banks will set the reallowancebonus as a portion of the spreadthey receive for bringing the offering to market. The offering may be an initial public offering(IPO), debt security, or the release of additional shares of a traded company."
844,Recapture Provision,A recapture provision is a provision in a reinsurance treaty that allows the ceding partyto take back some or all of the risk initially ceded to the reinsurer. Recapture provisions outline the circumstances in which a recapture can occur.,"When an insurance company underwrites a new policy, it agrees to indemnify the policyholder in exchange for a premium. This indemnification is a liability, and the insurer is responsible for covering losses of claims filed.There are regulatory and financiallimits on the amount of risk to which an insurer can expose itself. With each new policy written, the insurer lessens its ability to assume new risks. To reduceor spread the inherent risk, an insurer may enter into areinsurance treaty. The reinsurance treatywill containrules addressing how ceding companies may recapture risk in therecapture provision."
845,Reciprocal Insurance Exchange,Reciprocal insurance exchanges are a form of insurance organization in which individuals and businesses exchange insurance contractsand spread the risks associated with those contracts amongthemselves. Policyholders of a reciprocal insurance exchange are referred to as subscribers.,"A reciprocal insurance exchange is formed by bringing together two separate entities: a reciprocal inter-insurance exchange and an attorney-in-fact (AIF). The reciprocal inter-insurance exchange is used to allow subscribers to exchange policies through the attorney-in-fact, which allows them to spread around risk. The attorney-in-fact is authorized to perform business transactions on behalf of another entity, which, in this case, is the reciprocal insurance company. The AIF runs the day-to-day operations of the reciprocaland is provided with a power of attorney status by the reciprocal. The AIF may be owned by the reciprocal, referred to as a proprietary reciprocal, or may be contracted from a third party, referred to as a non-proprietary reciprocal."
846,Reinstatement,"Reinstatement is the restoration of a person or thing to a former position. Regarding insurance, reinstatement allows a previously terminated policy to resume effective coverage. In case of nonpayment, the insurer may require evidence of eligibility, such as an updated medical examination for life insurance, and full payment of outstanding premiums.",Reinstatement of a life insurance policy occurs after the end of a grace period and when the contract is no longer in force. Reinstatement requirements may vary among life insurance providers. There is noguaranteeby law for reinstatement terms. The reinstatement process may depend on how much time passed since the policy lapse and the type of insurance policy. Sometimes applying for a new policy may be less expensive than reinstating an old policy.
847,Reinstatement Clause,"A reinstatement clause is aninsurance policy clause that states when coverage terms are reset after the insured files a claim. Reinstatement clauses typically do not reset a policys coverage limit, but they do allow the policy to restart coverage for future claims.","A reinstatement clausestates when coverage terms are reset after the insured files a claim.Individuals and businesses purchase insurance policies to cover themselves from damages or losses caused by specific perils, such as fires and floods. Coverage is triggered when the peril being insured against occurs, at which point the insured can file a claim to receive money to cover damages. The amount that the insured can recoup from the insurer is set at a maximum amount, called the coverage limit. This limit may be set on a per occurrence, per risk basis, or aggregate loss basis."
848,Reinsurance,"Reinsurance, also known as insurance for insurers or stop-loss insurance, is the practice of insurers transferring portions of risk portfolios to other parties by some form of agreement to reduce the likelihood of paying a large obligation resulting from an insurance claim. The party that diversifies its insurance portfolio is known as the ceding party. The party that accepts a portion of the potential obligation in exchange for a share of the insurance premium is known as the reinsurer.",Reinsurance allows insurers to remain solvent by recovering some or all of amounts paid to claimants. Reinsurance reduces net liability on individual risks and catastrophe protection from large or multiple losses. It also provides ceding companies the capacity to increase their underwriting capabilities in terms of the number and size of risks.
849,Reinsurance Assisted Placement,A reinsurance assisted placement is reinsurance business developed through the assistance of areinsurancecompany.,"Reinsurance assistedplacements have thereinsureroffer matching funds to the original sale, which may have been made by a broker or agent. The reinsurer works in this case with the insurer, who may or may not cedeits policies. In any case, the insurerworks in cooperation with the reinsurerin a reverse flow arrangement."
850,Reinsurance Ceded,"Reinsurance ceded is the portion of risk that a primary insurer passes to a reinsurer. Reinsurance ceded allows the primary insurer (the ceding company) to reduce its risk exposure to an insurance policy it has underwritten by passing that risk onto another company (the accepting company), with the accepting company receiving a premium for taking on the risk. The accepting company pays a commission to the ceding company on the reinsurance ceded, and the ceding company can recover part of any claim from the accepting company.","Being able to cede a portion of its risk allows an insurance company to manage its overall risk exposure. Reinsurance can be written by a specialist reinsurance company, such as Lloyds of London or Swiss Re, by another insurance company, or by an in-house reinsurance department. Some reinsurance can be handled internally, such as with automobile insurance, by diversifying the types of clients that are taken on. In other cases, such as liability insurance for a large international business, specialty reinsurers may be used because diversification is not possible."
851,Reinsurance Credit,Reinsurance Credit is an accounting entry made by an insurer for premiums ceded to reinsurers and losses recovered from reinsurers. Reinsurance credit procedures allow an insurance company to treat money owed by reinsurers for covered losses as assets.,"When an insurance company enters into a reinsurance contract, it is agreeing to shift some of the risk from the policies that it has underwritten to the reinsurer, and in turn will provide the reinsurer with a portion of the premium that it earns on those policies. Using reinsurance allows an insurer to underwrite more policies because its overall risk profile is reduced, but also opens up the insurer to reinsurance credit risk. This is the risk associated with the reinsurer becoming insolvent, and thus becoming unable to fulfill its portion of the reinsurance agreement. If the reinsurer is unable to cover the claims that it is contractually obligated to, the insurance company may find itself with a much larger liability than anticipated."
852,Reinsurance Recoverables,"Reinsurance recoverables are the portion of an insurance companys losses from claims that can be recovered from reinsurance companies. Reinsurance recoverables includes the amount owed to the insurer by the reinsurer for claims and claims-related expenses, the amount owed for estimated losses that have occurred and been reported, the amount of incurred but not reported (IBNR) lossesand the amount of unearned premiums paid to the reinsurer.","Insurance companies primarily make money from their underwriting activities. When an insurer underwrites a new policy, it collects premiums from policyholders, but it also takes on the liability associated with providing the coverage. Insurance regulators require insurers to set aside reserves in order to cover potential claims made against the policies that the insurer underwrites. The insurer will find its underwriting activities limited by how much risk it can handle. One way an insurer can reduce its risk exposure is by sharing some of this risk with reinsurance companies. Essentially, the insurer is purchasing insurance to cover a risk."
853,Reinsurance Recoverables to Policyholder Surplus,Reinsurance recoverables to policyholder surplus is the amount of incurred losses covered by reinsurers compared to policyholders surplus.,Reinsurance recoverables to policyholder surplus is used to determine how dependent an insurer is on reinsurers for policy protection. This also helps evaluate the risk that the insurer has to account for when it comes to adjustments in reinsurance.
854,Reinsurance Sidecar,A reinsurance sidecar is a financial entity that solicits private investment in a quota share treatywith an insurance company. In the quota treatythe ceding company and reinsurer share premiums and losses according to a fixed percentage.Investors who take part in reinsurance sidecars share in premiums and losses from the underwritten policies. Profits and losses will be in proportion to the amount invested.,"Typically, existing reinsurers will create sidecars as they try to spread the risk among third-party investors such as hedge funds and equity firms. "
855,Reinsurance Ticket,"A reinsurance ticket is a notification made by an insurer that discloses the different reinsurance contracts that have been affected by claims, as well as other information affecting the terms of a reinsurance contract. Reinsurance tickets are included in the claims clause of the reinsurance contract.","Most policyholders don't deal with reinsurance tickets; they reflect insurance companies' business-to-business dealings. Reinsurance contracts provide instructions when it comes to how ceding insurers and reinsurers are to share information with each other. The most important aspect of information-sharing relates to claims notifications, as the ceding insurers need to provide information about claims that have been filed – and losses that may be incurred – against policies that the reinsurer is responsible for. In order to keep track of which reinsurance contracts have been impacted on a particular day, an insurer will attach a reinsurance ticket to its daily report. Originally, this notation was in the form of a separate piece of paper literally attached to the insurer's report that listed the details, which led to the""reinsurance ticket"" nomenclature."
856,Reinsurer,"A reinsurer is a company that provides financial protection to insurance companies. Reinsurers handle risks that are too large for insurance companies to handle on their own and make it possible for insurers to obtain more business (that is, underwrite more policies) than they would otherwise be able to. Reinsurers also make it possible for primary insurers to keep less capital on hand to cover potential losses.","A primary insurer, which is the insurance company from whichan individual or business purchases a policy, transfers risk to a reinsurer through a process called cession. Just as insurance policyholders pay premiums to insurance companies, insurance companies pay premiums to reinsurers. The premiums primary insurers pay to reinsurers may be reduced by any commission the reinsurer pays to the insurer. The price of reinsurance, like the price of insurance, depends on the amount of risk. Reinsurers often have the wordRe in their names (e.g., Allianz Re, Cologne Re, Swiss Re)."
