,term,definition,break_down
538,Frequency-Severity Method,Frequency-severity method is an actuarial method for determining the expected number of claims that an insurer will receive during a given time periodand how much the average claim will cost. Frequency-severity method uses historical data to estimate the average number of claims and the average cost of each claim. The method multiplies the average number of claims by the average cost of a claim.,"In the frequency-severity method, frequency refers to the number of claims that an insurer anticipates will occur over a given period of time. If the frequency is high, it means that a large number of claims is expected to occur. Severity refers to the cost of a claim. A high-severity claim is more expensive than an average claim, and a low-severity claim is less expensive than the average claim. Average costs of claims are estimated based on historical data."
539,Fronting Policy,"Fronting policy is arisk management technique in which an insurer underwrites a policy to cover a specific risk, but then cedes the risk to a reinsurer. Fronting policies are most commonly used by large organizations, and is a type of alternative risk transfer (ART). Because the reinsurer takes on the entire policy risk, it has complete control of the claims process.","The insurance company that underwrites the original policy is called the fronting company. The fronting company receives a percentage of the premium despite ceding all of the risks to the reinsurer. By issuing the insurance policy, the fronting company appears to be the insurer, though in reality it transfers all risk to the reinsurer."
540,Full Reporting Clause,"A full reporting clause, also known as an honesty clause, is a provision to an insurance policy requiring the policyholder to provide the insurer with the value of insured items. Property insurance policies contain full reporting clauses.","Determining the cost of articles covered by an insurance policy is an essential part of insurance contracts. While it is a time-consuming step, it allows individuals and businesses to estimate the total amount of coverage they need. Understanding how much an item is worth lets insurers determine replacement costs when losses occur."
541,Fully Subscribed,Fully subscribed is the position an initial bond or stock offering finds itself in once all shares of an offering have been purchased or guaranteed by investors. An underwriting company usually facilitates these initial transactions on behalf of younger companies that are making their initial public offerings.,"A fully subscribed offering is the goal of an initial offering. It prevents a company from having shares left over that they cannot sell after they go public, or shares that must undergo a price reduction to be purchased by investors."
542,Funding Cover,"Funding cover refers to insurance premiums held in an account in conjunction with an excess-of-loss reinsurance, which is used to pay insurance claims. Funding covers act as a resource pool that can be drawn down to pay for claims, with unused funds returned to either policyholders or ceding insurers.","Funding covercan be used to generate investment income.When an insurance company underwrites a new policy it is agreeing to indemnify the policyholder from covered losses. In exchange for taking on this risk the insurer is paid a premium. The premium is used to pay claims, as well as generate investment income. Insurers have to balance the mechanisms they use to manage funding for future claims with their desire to generate profits by investing premiums."
543,Fureai Kippu,"Fureai kippuisa complementary currency system for providing elder care in Japan. The system of fureai kippu, or ""caring relationship tickets,"" allows individuals to earn credits by caring for a local elderly or handicapped person. They can redeem those credits toward care for a non-local elderly person, such as a parent who lives far away or themselves if they get sick. The tickets can also be saved and redeemed in the future.","Tsutoma Hotta, former Attorney General and Minister of Justice in Japan, coined the termfureai kippu and created this system in the mid-1990s."
544,Furriers Block Policy,"A furriers block policy is a specialty insurance policy historically intended to cover the inventory of a fur dealer against transportation risk. Specifically, this policy was intended to protect the dealer against inventory loss during transit along inland waterways.","Furriers block policies became a specialized form of insurance in the 19th century. Like precious gems and jewels, furs were extremely delicate and valuable items that involved lengthy and risky travel from source to market. Fire, smoke, water damage and theft were historically among the chief threats to inventory along the supply chain. Traditional commercial insurance was generally too expensive to cover such valuables. In more recent years, protest and vandalism have emerged as risks to furriers inventories."
545,Furriers Customers Policy,A furriers customers policy is an inland marine insurance policy that provides coverage against loss or damage to furs that are being stored by a business on behalf of a third party. Furriers customers policies provide coverage beyond the ordinary care that a storage company is expected to provide with respect to the property of its customers.,"Furriers customers policies are designed specifically for businesses that store furs and garments trimmed with fur owned by third parties. The total amount of coverage required, depends on the number of furs held in storage and the value of the furs according to the bailor."
546,Future Purchase Option,"A future purchase option is afeature of long-term disability insurance that allows policyholders to increase their insurance coverage annually as their income increases, without medical underwriting, in exchange for paying a higher premium.","The future purchase option is typically valid until the policyholder reaches a specified age. The future purchase option means that even if a policyholder develops a health condition that would make it expensive or impossible to qualify for a new policy, they can purchase additional coverage under their existing policy because the future purchase option does not require the policyholder to pass a medical exam."
547,Gap Insurance,Gap insurance is a type of auto insurance that car owners can buy to protect themselves against losses that can arise when the amount of compensation received from a total loss does not fully cover the amount the insured owes on the vehicle's financing or lease agreement. This situation arises when the balance owed on a car loan is greater than the book value of the vehicle.,"As an example of gap insurance at work, considerJohn's car, which isworth $15,000. However, he still owes a total of $20,000 worth of car payments. In the event that John's car is completely written off as a result of an accident or theft, John's car insurance policy will reimburse him with $15,000. Because John owes the car financing company $20,000, however, he will still be $5,000 short, even though he no longer has a car."
548,Garage Liability Insurance,"Garage liability insurance is specialty insurance targeted to the automotive industry. Automobile dealerships, parking lots or parking garages operators,tow-truck operators, service stations, andcustomization and repair shops will add garage liability insurance to their business liability coverage. The policy protects property damageand bodily injury resulting from operations.",This insurance is not the same thing as garage-keepers coverage.
549,Gatekeeper,"A gatekeeper refers to requirements that must be met before an individual can qualify for a long-term care plan or to an individual who oversees a patient treatment through a health maintenance organization, or HMO.","Because there are two different definitions for what a gatekeeper is, they can be analyzed separately."
550,General Account,"The general account is where an insurer deposits premiums from policies it underwritesand from which it funds day-to-day operations of the business.The general account does not dedicate collateral to a specific policy, and instead treats all funds in aggregate.","When an insurance company underwrites a new policy, it is paid a premium by the policyholder. These premiums are deposited into the insurers general account. The insurer will use these funds in a variety of ways. It will set aside a portion as a loss reserve, which is used to cover the estimated losses it expects may occur over the course of the year. It will also use these funds to pay for operations, personneland other business expenses. In order to increase profitability, however, it will also invest some of these premiums in assets of various risk profiles and liquidities."
551,General Employer,"A general employer is an employer who loans an employee to another business, and who is the employees original employer. Such arrangements are usually conducted on a temporary basis. A general employer is not held responsible for the actions of the employee; instead, the business that borrows the employee is responsible despite not being the permanent employer.","General employer is the term that describes a business that lets another business borrow one or more of its employees for a specified period time. This arrangement is regulated under theborrowed servant rule. The borrowed servant rule shifts liability from the workers regular employer to the employer that is temporarily borrowing the workers. The temporary employer is called the special employer, since the arrangement is typically temporary."
552,Genetic Engineering,"Genetic engineering is the artificial modification of an organisms genetic composition. Genetic engineering typically involves transferring genes from one organism into another organism of a different species to give the latter specific traits of the former. The resulting organism is called a transgenic or genetically modified organism, or GMO. Examples of such organisms include plants that are resistant to certain insects and plants that can withstand herbicides.","Genetic engineering is also being used on farm animals, with research objectives such as ensuring chickens cannot spread avian flu to other birds, or that cattle cannot develop the infectious prions that causemad cow disease."
553,Genomics,"Genomics refers to the study of the entire genetic code of any particular species. In humans, this code contains about 3billion pairs of chemicals that make up DNA and the entire code is replicated within each cell in the body. The study of genomics achieved prominence in the late 1990s as scientists raced to create a comprehensive map of the entire human genome.",
554,Good Student Discount,"Good Student Discount is an auto insurance policy discount available to young drivers who earn good grades in school. The good student discount assumes that if a young driver is responsible when it comes to their studies, they are more likely to be a responsible driver. As a result, they (or their parents) deserve to pay lower insurance premiums since they are less likely than teens with poor grades to file a claim with the insurance company. Since teenage drivers face some of the highest insurance premiums due to their lack of driving experience and higher accident and traffic violation risk, a good student discount provides yet another incentive to do well in school: saving money.","Insurance companies are free to decide whether to offer a good student discount and, if so, to set their own guidelines for those discounts. For example, one insurer might offer a 25% discount on premiums to full-time high school and college students who earn good grades, defined as a B average or higher, until age 25. Another insurer might offer a 15% good student discount to unmarried drivers with at least a 3.0 grade point average in high school or college."
555,Graham-Cassidy Healthcare Bill,"The Graham-Cassidy bill is a Republican effort to repeal and replace the Affordable Care Act (ACA or ""Obamacare"") that would transfer much of the responsibility for structuring, funding and regulatingof healthcare markets to the states. It was proposed by Senators Bill Cassidy (R-La.) and Lindsey Graham (R-S.C.) in September 2017, following a number of failed attempts to roll back Obamacare from March to July. Although they planned to vote on the bill during the week of September 25, following an incomplete Congressional Budget Office (CBO) score, the vote did not happen. The decision not to vote on the Graham-Cassidy bill marked the fourth Obamacare repeal bill failure in 2017,",The bill's full name is the Graham-Cassidy-Heller-Johnson bill;Dean Heller (R-Nev.) and Ron Johnson (R-Wis.) are co-sponsors.
556,Grandfathered Health Plan,"A grandfathered health plan is a health insurance policy created or purchased on or before March 23, 2010. A grandfathered health plan is exempt from many consumer protections required under the Patient Protection and Affordable Care Act (ACA), the U.S. health reform signed into law on March 23, 2010 by President Obama. Grandfathered status applies to group health plans and individual health insurance policies respectively crated or purchased before enactment of the ACA. With group plans (through an employer), grandfathered status depends on the date of plan creation, not the date an employee joins the plan.",
557,Greenshoe Option,"In security issues, a greenshoe option is an over-allotment option. In the context of an initial public offering (IPO), it is a provision in an underwriting agreement that grants the underwriter the right to sell investors more shares than originally planned by the issuer if the demand for a security issue proves higher than expected.","Over-allotment options are known as greenshoe options becausein 1919, Green Shoe Manufacturing Company (now part of Wolverine Worldwide Inc.)was the first to issue this type of option. A greenshoe option can provide additional price stability to a security issue because the underwriter has the ability to increase supply and smooth out price fluctuations. It is the only type of price stabilization measure permitted by the Securities and Exchange Commission (SEC)."
558,Gross Leverage Ratio,"Gross leverage ratio is the sum of an insurance companys net premiums written ratio, net liability ratio and ceded reinsurance ratio. Gross leverage ratio is used to determine how exposed an insurer is to pricing and estimation errors, as well as its exposure to reinsurance companies.","The ideal gross leverage ratiodepends on what type of insurance a company is underwriting, though the desired range typically falls below 5.0 for property insurers and7.0 for liability insurers. An insurers gross leverage will typically be higher than its net leverage because the gross leverage ratio includes ceded reinsurance leverage. Other types of leverage ratios used in the insurance industry include net leverage, reinsurance recoverables to policyholders surplus, and Bests Capital Adequacy Ratio (BCAR)."
559,Gross Line,Gross line is the maximum amount of coverage an insurer is willing to underwrite for a particular risk. The gross line is calculated before anydeductions and represents the insurers totallimit of liability.,"Gross line sets the total amount of liability an insurer is willing to take on in exchange for the premiums being paid to cover that risk. An insurer will often reduce their gross risk by using reinsurers. This allows them to move some of the liability off of their books, which in turn opens up their capacity to underwrite additional policies."
560,Gross National Happiness - GNH,"Gross national happiness is a measure of economic and moral progress that the King of Bhutan introduced in the 1970s as an alternative to gross domestic product. Rather than focusing strictly on quantitative economic measures, gross national happiness takes into account an evolving mix of quality-of-life factors.","Gross national happiness (GNH) is a term with roots in the Himalayan country of Bhutan. The kingdoms first legal code, written at the time of unification in 1729, stated thatif the Government cannot create happiness for its people, there is no purpose for the government."" King Jigme Singye Wangchuck told the Financial Times in a 1972 interview thatgross national happiness is more important than gross national product. It is not clear how seriously King Jigme had thought through this new metric, but Bhutanese scholars have since picked up the idea and run with it. The GNH has evolved into a somewhat scientific measure of the once-isolated kingdom's economic and moral development."
561,Gross Net Written Premium Income,"Gross net written premium income (GNWPI)isthe amount of an insurance companys premiums that are used to determine what portion of premiumsis owed to a reinsurer. Gross net written premium income is the base, which thereinsurance premium rate is applied to, takinginto account cancelations, refunds, and premiums paid for reinsurance coverage.","Gross net written premium income isthe amount of an insurance companys premiums utilizedto determine the portion of premums due to the reinsurer.When an insurance company enters into a reinsurance agreement, it reduces its overall risk exposure by ceding some risks to a reinsurer. In exchange for taking on these risks, the reinsurer is entitled to a portion of the insurers premiums. In a non-proportional reinsurance agreement, the amount of premiums that the reinsurer is entitled to is determined by a fixed rate. This rate is multiplied by a base premium, which represents the amount of an insurers premiums that the reinsurer is entitled to."
562,Gross Profits Insurance,"Gross profits insurance is a type of business interruption insurance that provides funds in the amount of profit lost if an insurable event, such as property damage, occurs. Gross profits insurance is most commonly used in the United Kingdom and Canada. This type of insurance differs from gross earnings insurance, which is more commonly found in the United States.","Gross profit insurance is designed tobring back the insured to where it would have been financially assuming the insurable event had not occurred. The amount of loss that a business experiences is calculated based on a pre-defined formula, and typically relies on historical rates of turnover to determine the amount a business is losing. Gross profit is calculated as turnover less purchases and variable costs. The loss formula looks at turnover over a specific period of time, such as twelve months, though extenuating circumstances that have affected turnover during the examination period may need to be smoothed out."
563,Ground-Up Loss,"Ground-up loss is thetotal amount of loss that is covered by an insurance policy. Ground-up loss does not include deductibles paid by the insured, nor does it include reinsurance recoverables.","Insurance companies take a number of factors, including ground-up loss, into account when determining the total amount of coverage they are willing to extend to a policyholder when underwriting a new insurance policy. The insurers baseline consideration is based on the ground-up loss, which represents the total loss that the insurer will have to cover if the insured does not have to pay a deductible and if the insurer does not cede any liability to a reinsurance company."
564,Group Health Insurance Plan,A group health insurance plan is a health insurance plan that provides coverage to members of a group that tends to be employees of a company or members of an organization. Members of the group usually receive insurance at a reduced cost because the insurers risk is spread across a group of policyholders.,"Group health insurance in the United States has evolved during the 20th century. The idea of collective coverage first entered into public discussion during World War I and the Great Depression. Soldiers fighting in the First World War received coverage through the War Risk Insurance Act, which Congress later extended to cover servicemens dependents. In the 1920s, healthcare costs increased to the point that they exceeded most consumers ability to pay. The Great Depression exacerbated this problem dramatically, but resistance from the American Medical Association and the life insurance industry defeated several efforts to establish any form of a national health insurance system. This opposition would remain strong into the 21st century."
565,Group Life Insurance,"Group life insurance is offered by an employer or other large-scale entity, such an association or labor organization, to its workers or members. This life insurance, which typically is inexpensive or even free, and has relatively low coverage amount, is typically offered as a piece of a larger employer or membership benefit package.","By purchasing group life insurance policy coverage through an insurance provider on a wholesale basis for its members, companies are able to secure costs for each individual employee that are much lower than if they were to purchase an individual policy."
566,Group Term Life Insurance,"Group term life insurance is a type of term insurance whereby the insurer issues the employer a master contract with coverage extended to employees. Group term life insurance is relatively inexpensive compared to individual life insurance. As a result, participation is high. It is commonly a component of a comprehensive benefits package.",
567,Group Universal Life Policy (GULP),A group universallife policy isuniversal life insuranceoffered toa group that is less expensive than what is typically offered to an individual.A group universal life policy is most commonly purchased by businesses looking to provide life insurance coverage for their employees.,"Buying a group universal life policy is similar to buying food in bulk. The cost to cover each individual is cheaper because the policy is designed to cover a large group, just as purchasing a large amount of a particular grocery item is cheaper on a per item basis than buying each item separately."
568,Guaranteed Cost Premium,Guaranteed cost premium refers to cost premiums charged for an insurance policy that are not adjusted for loss experience. Guaranteed cost premium represents a flat fee that the insured pays for coverage over a policy period.,"Most policyholders are familiar with the guaranteed cost approach to determining the premiums that they pay for insurance. An individual or business purchases a policy to cover a specified peril for a specified period of time, and is charged a flat rate for the duration of the policy. While the insurance company does take into account the type of peril, the potential severity and frequency of claims, and the riskiness of the insured, the premium is not adjusted once it has been published."
569,Guaranteed Investment Contract - GIC,Insurance contracts that guarantee the owner principal repayment and a fixed or floating interest rate for a predetermined period of time. ,Guaranteed investment contracts are typically issued by insurance companies and marketed to institutions that qualify for favorable tax status under federal laws. These products provide institutions with guaranteed returns. 
570,Guaranteed Investment Fund (GIF),"Guaranteed investment income is a type of investment product offered by insurance companies that allows its client to invest in an equity, bond and/orindex fund while providing a promise ofapredefined minimum value of the fund (usually, the initial investment amount) will be available at the fund's maturity or when the client dies. Insurance companies usually charge up to 1 percentof the investment amount per year for this service.",Some guaranteed investment income funds also give people the opportunity to resetthe guaranteed amount during specific periods of time. This allows investors to lock in greater sums in the event that they incur a large capital gain.
571,Guaranteed Issue Life Insurance ,"Guaranteed issue life insurance, or guaranteed acceptance life insurance, is a life-insurance policy with no health qualifications.","Guaranteed issue life insurance, like all life insurance, pays cash to a named beneficiary upon the death of the insured. The key difference is that with guaranteed issue life insurance a company cannot deny an applicant coverage as long as that applicant can afford the premiums. Because guaranteed issue life insurance policies are available to people with no medical underwriting, they charge higher premiums for lower payouts than conventional policies. For that reason, guaranteed issue life insurance tends to attract applicants with health histories that preclude their enrolling in better policies and who cant purchase life insurance through their employers."
572,Guaranteed Issue Rights,"Guaranteed issuerights are rightsafforded to individuals insured under Medicare that requires insurance companies to offer Medicare supplement insurance, also called a Medigap policy. Guaranteed issue rights prevent insurers from denying a Medigap policy, from placing restrictions on the policy due to previous medical conditions, or from charging more because of previous conditions.","Guaranteed issue rights, also called Medigap protections, protect individuals who lose their health care coverage or if their health care coverage changes. These rights apply to those who have a form of Medicare insurance already, including Original Medicare and Medicare Advantage, or if the individual previously had Medigap insurance but later moved to a different form of Medicare. In order to qualify an individual must have both Medicare Part A and Medicare Part B, but the individual is not allowed to purchase the policy if he or she already has a Medicare Medical Savings Account."
