,term,definition,break_down
0,Abandonment Clause,"An abandonment clause in a property insurance contract, under certain circumstances, permits the property owner to abandon lost or damaged property and still claim a full settlement amount. If the insured party's property cannot be recovered, or the cost to recover or repair it is more than its total value, it can be abandoned and the insured party is entitled to a full settlement amount.","The abandonmentclause typically comes into play with marine property insurance, such as boats or watercraft. If a property owner's ship is sunk or lost at sea, the abandonment clause affords the owner the right to essentially ""give up"" on finding or recovering his or her property and subsequently collect a full insurance settlement from the insurer."
1,Abandonment and Salvage,Abandonment and salvage describes the forfeiture of property and the ensuing claim over that property by a second party.,"Abandonment and salvage can be added as a clause in an insurance contract, which gives the insurer the ability to accept the abandoned property. Abandonment must be expressed with intent. The potential financial rewards mean that salvage rights are sometimes legally contested by several parties. Salvage and abandonment clauses are usually found in marine insurance contracts."
2,Abbreviated New Drug Submission (ANDS),"An Abbreviated New Drug Submission (ANDS)is awritten request to Health Canada to obtain marketing approval for a generic drug. An Abbreviated New Drug Submission must be approved by Health Canada, the countrys federal department in charge of national health care, under Canadas Food and Drug regulations, before the generic drug can be marketed in the country. An ANDS provides the necessary information for the government agency to evaluate how safe and effective a generic drug is compared with its brand-name equivalent. The generic must be equally safe and effective to gain approval.","An Abbreviated New Drug Submission is used to obtain approval for generic drugs. This is in contrast to a New Drug Submission (NDS), which is used to obtain approval for a newbrand-name drug. An ANDSlists the related drugs brand name, chemical name, manufacturer name, dosage form(s) and strength(s). It states whether the drug has already been approved for marketing in the United States, the European Union, Switzerland, Singapore and/or Australia. It also addresses questionsabout drug impurities and drug stability."
3,Absolute Exclusion,"An absolute exclusion is an insurance policy clause that eliminates coverage of certain events. This type of clause allows insurers to deny coverage of claims regardless of how the event came to be, even if the claim only relates to the type of exclusion remotely. Insurers use absolute exclusions to clarify what events they will not cover in a policy, regardless of how an event comes to pass.","Insurance companies must provide policyholders with plainly worded forms that any absolute exclusions clear. If insurers willfully obscure or omit policy information or fail to provide clear, comprehensive forms, policyholders somteimtes take them to court for bad faith insurance practices."
4,Absolute Pollution Exclusion,"Absolute pollution exclusion is a commercial liability insurance policy clause that removes coverage of pollution that results from regular business operations. Absolute pollution exclusions to comprehensive general liability insurance policies became common after 1986, when standard pollution exclusions no longer containedsudden and accidental pollution incidents.","Absolute pollution exclusions came about in response to government regulations of environmentally harmful materials. Perhaps the most well-known case involved the Montrose Chemical Corporation of California, which produced dichlorodiphenyl- trichloroethane, commonly known as DDT. The company discharged waste into the Pacific Ocean for decades, and a federal lawsuit required the company to pay for the environmental cleanup costs resulting from the waste it produced."
5,Accelerated Benefits,"Accelerated benefits refers to aclause in certain life insurance policies that enablethe policyholder to receive the benefits before death. Accelerated benefits are normally reserved for those that suffer from a terminal illness, have a long term high-cost illness, require permanent nursing home confinement or have a medically incapacitating condition. Some insurance companies differ on how much cash can be pulled out and how close to death the insured has to be in order to receive these benefits. Insurers offer anywhere from 25to 100 percentof the death benefit as an early payment.Accelerated benefits are also referred to as living benefits.",Choosing an insurance policy with an accelerated benefitsallows the policyholder to pay for their daily living in an effort to make it ascomfortable as possible while also allowing the holder to look after his or her family once they pass away. This type of benefit was originally started in the late 1980s in an attempt to alleviate the financial pressures of those that were diagnosed with AIDS.
6,Accelerated Death Benefit (ADB),An accelerated death benefit (ADB) is a benefit that can be attached to a life insurance policy that enables the policyholder to receive cash advances against the death benefit in the case of being diagnosed with a terminal illness. Many individuals who choose anaccelerated death benefit have less than one year to live and use the money for treatments and other costs needed to stay alive.,Choosing an insurance policy with an accelerated death benefit (ADB) allows the policyholder to pay for their daily living in an effort to make it ascomfortable as possible while also allowing the holder to look after his or her family once they pass away. This type of benefit was originally started in the late 1980s in an attempt to alleviate the financial pressures of those that were diagnosed with AIDS.
7,Accelerated Option,"An acceleratedoption in an insurance contract, usually in the form of a rider,allows for accelerated benefits or partial benefits sooner than they would otherwise be payable. Alternatively, in life insurance contracts, an accelerated option can refer to the option that allows the policy holder to apply the accumulated cash value to pay off the policy.","One form of an accelerated option is the accelerated death benefit rider in a whole life insurance policy. Accelerated benefits, also known as ""living benefits,"" are life insurance policy proceeds paid to the policyholder before he or she dies. The benefits may be provided in the policies themselves, but more often they are added by riders or attachments to new or existing policies."
8,Acceleration Life Insurance,"A type of policy that pays a portion (typically 25% or 50%) of the death benefits (the face amount of the policy, less any outstanding loans or fees) in case of a specified illness or medical emergency.  ","The accelerated death benefit provides funds necessary to pay for medical costs, to extend the life of the insured. Insurance companies pay the specified percentage of the death benefit in a lump sum.Upon death, the remainder of the insured's death benefit is paid to the beneficiary, just as under a traditional life insurance policy."
9,Accelerative Endowment,An accelerative endowment is anoption in a whole life insurance policy to use accumulated dividends to convert the policy into an endowment policy prior to its normal maturity date. An endowment policy provides for a lump sum payment to the insured after a certain period.,An accelerative endowment is a form of an accelerated option that allows policyholders to access the value of their life insurance policies prior to death.The main benefit of accelerative endowments is that they give policyholders the option to receive a lump sum of money before their death. This is different from other life insurance options that only provide benefits upon the death of the insured. The lump sum allows the insured to make more investments or later earn a fixed income through the purchase an annuity policy. Or the lump sum received can be invested any way a policyholderwants.
10,Accident And Sickness Insurance Act,"This is a Canadian government statute that defines the acceptable terms and conditions of  health insurance coverage and sets out guidelines to which these policies must conform. It is now known as the Uniform Accident and Sickness Insurance Act, which is the model law adopted by the Canadian Council of Insurance Regulators (CCIR). The model legislation has been enacted, with minor variations, by all Canadian provinces. ","In Canada's extremely competitive life and health insurance market, the enactment of national laws and the ability to establish uniform standards agreed-to by all the provincial governments was a feat of great magnitude. It serves as a model for other nations with decentralized standards and licensing requirements. "
11,Accident-Year Statistics,Accident-Year Statistics are used by insurance companies to gauge what percentage of the premiums received are being paid out in claims. They are a measure of the total losses against the total revenue (both deductibles and premiums).,"Accident year statistics are a useful tool with regards to setting the premiums on all types of insurancefor the following year. In watching the trends of the accident-year statistics, insurance companies are able to forecast what their losses are likely to be, and therefore, decide what premiums to charge in order to make a profit."
12,Accidental Death And Dismemberment Insurance (AD&D),"Accidental death and dismemberment insurance (AD&D) is usually a rider to a health insurance or life insurance policy. The rider covers the unintentional deathor dismembermentof the insured. Dismemberment includes the loss, of or the loss of use, of body parts or functions (e.g., limbs, speech, eyesight, or hearing). Because of coverage limitations, prospective buyers should carefully read the terms of the policy.",
13,Accidental Death Benefit,"The accidental death benefit ispayment due to the beneficiary of an accidental death insurance policy, which is often a clause orrider connected to a life insurance policy. The accidental death benefit is usually an amount paid in addition to the standard benefit payable if the insured died of natural causes.","Depending on the issuer of the policy, the accidental death benefit may extend up to a year after the initial accident occurred, so long as the accident led to the insured's death."
14,Accidental Means,"Accidental means is a condition for losses covered under an insurance policy that requires the loss to have been the result of an accident, rather than the result of a non-accident. As a condition, accidental means is designed to protect insurers from having to pay claims on events that were not accidents.","Insurers use the wordaccident to describe an event that happens unintentionally, and which is unexpected or unforeseen. Accidental means may involve acts that caused damage or harm, but which were themselves accidental. Both the injury and the event have to be considered accidents in order for a claim to be covered. Accidental means is a precise definition ofaccident, and is stricter than merely defining an accident as an unforeseen event."
15,Account Current,"The account current is a summary statement detailing the financial performance of an individual insurance agents business over a specified period. These statements form the basis for reconciliation of accounts between the insurer and the agent. The account current provides the basis of a paper trail as premiums paid by policyholders travel between insurance provider, agencies, and agents.","An account current lays out the financial components of an insurance agents business in detail. The statement is usually comprehensive in that it specifiespremium and claim performance at the individual policy level. The accounting also typically shows summary transaction information as a record of balances owed. These balances are due to either to the insurance agent or the insurer, depending on the balance of claims paid, the premiums which are writtenand those which are returned, and commissions."
16,Accountable Care Organizations,"Accountable Care Organizations are networks of healthcare providers who collaborate to provide improved and more cost-effective treatment to patients. These organizations were established under Medicare Shared Savings Program, a portion of the Affordable Care Act of 2010. These organizations were originally designed to support Medicare participants but have grown to include private payer networks as well.","Accountable care organizations (ACOs) were designed to share information, provide more cost-effective treatments services, and eliminate redundancies for patients in the Medicare system. ACOs are structured around a patients primary care physician (PCP), but should also include hospitals, pharmacies, specialists, and other service providers to achieve optimal efficiency. The ACO model was introduced through the Medicare Shared Savings Program, a component of the 2010 Affordable Care Act (ACA). The ACA mandates that an approved ACO manage the healthcare of a minimum 5,000 patients over a three-year period. ACOs are overseen by the Centers for Medicare and Medicare Services (CMS)."
17,Accounts Receivable Insurance,Accounts receivable insurance protects a company against financial losses caused by damage to its accounts receivable records. This type of coverage is important because theloss of accounts receivable records may render afirmunable to collect money it is owed by customers.,"Accounts receivable insurance provides protection for a variety of situations involving a company's accounts receivable records. First, it will cover a firm for sums that can't be collected fromcustomers due torecords beingdamaged or destroyed by a covered peril. Accounts receivable coverage will also cover a policyholder for interest charges on a loanobtained to offset uncollected sums."
18,Accredited Advisor In Insurance - AAI,An Accredited Advisor in Insurance (AAI) is a credential earned by insurance professionals after a course of study and a series of examinations.,Accredited Advisor in Insurance is a professional designation earned by insurance producers who demonstrate superior knowledge of their field compared to average agents. Insurance professionals earn the title by passing a series of three tests administered by the Insurance Institute of America. The knowledge gained from the course of study required to pass these tests can aid insurance agents selling sophisticated products or dealing with unusually complex insurance situations.
19,Accumulated Value,"Accumulated value is the total amount an investment currently holds, including the capital invested and the interest (gain) it has earned to date. Accumulated value is important in the insurance field because it refers to the total acquired value of awhole (or universal)life insurancepolicy. It is calculated as the sum or total of the initial investment, plusinterest earned to date. Accumulated value is alsoreferred to as accumulated amount or cash value.","For insurance purposes, accumulatedvalue begins to buildwhen the policyholder of a whole (or universal) life insurance policy startspayinga monthly premium. An insurance company takes thosepremium payments and divides theminto two portions. The first portion covers the basic insurance policy costs. The second portion acts as a type of investment that accumulates cash value, which is placed in an internal account by the insurance company."
20,Accumulation Option ,"An accumulation option is a policy feature of permanent life insurance that reinvests dividends back into the policy, where it can earn interest.Some types of insurance pay dividends to their policyholders each year when the insurance company performs better than estimated.Accumulation options areone of several optionspolicyholders have for what to do withthedividends they receive. An accumulation option is also known as an""accumulation at interest dividendoption,"" ""accumulation at interest option"" or ""dividends on accumulation.""","Accumulation options are available to participating permanent life insurance policyholders. The interest earned is taxable to the policy owner annually. The total dividend balance is payable in addition to the face amount of the whole life policy as a death benefit, as well as, being included with the whole life policy guaranteed cash value upon the surrender of the policy."
21,Act Of God,"An act of God describes an event outside of human control or activity. It's usually a natural disaster, such as a flood or an earthquake. Insurance policies usually specify which particular acts of God they cover, if any.",The phraseact of God is not actually associated with any particular religion or belief system. Contractual languagereferring to acts of God are known as force majeure clauses.
22,Act-as-One Provision,An act-as-one provision is areinsurance contract provision requiringreinsurers that are party to a single contract to work together to choose a single arbitrator in the case of a dispute. An act-as-one provision is used when multiple reinsurance companies are involved in the same disputeand prevents a situation in which multiple arbitration panels are being used to represent different reinsurers.,"Act-as-one provisions streamline the settling of disputes by treating all reinsurers associated with the dispute as one, rather than involving many different arbitration panels in the proceedings. By forcing the reinsurers to work together, the process bypasses confusion. The dispute is thus between the reinsured and a group of reinsurers that are all treated as if they were part of a single reinsurance company."
23,Active Retention,"Active retention is the act of protecting against a loss by designating specific funds to pay for it. This is the opposite practice of passive retention, in whichno funds are set aside to cover an upcoming or estimated loss.","Active retention, also sometimes known as planned retention, is used to ensure the ability to cover smaller or expected losses. It is viewed as a form of self-insurance whereas the entity expected to experience the loss relies on their own funds to cover any occurrences. This practice can be used by those looking to avoid additional fees and costs associated with dealing with agencies, or for activities that may not qualify for traditional insurance."
24,Actual Authority,"Actual authority refers to specific powers, expressly conferred by a principal (often an insurance company) to an agent to act on the principal's behalf. This power may be broad, general power or it may be limited, special power. Specific powers are alsoknown as ""express authority.""","Actual authority arises where the principal's words or conduct rationally cause the agent to believe that he or she has been empowered to act. An agent receives actual authority either orally or in writing. Written authority is preferable, as verbal authority is somewhat difficult to verify. In a corporation, written express authority includes bylaws and resolutions from directors' meetings which grant the authorized person permission to carry out a specificact on behalf of the corporation.Ifan agent, operating under actual authority,enters into a contract with a third party, the contract will create contractual rights and liabilities between the principal and the third party."
25,Actual Cash Value,"Actual cash value is the amount equal to the replacement cost minus depreciation of a damaged or stolen property at the time of the loss. It is the actual value for which the property could be sold, which is always less than what it would cost to replace it.","Sometimes, insurance companies use actual cash value to determine the amount to be paid to a policyholder after loss or damage to the insured property. In the case of an automobile that is totaled in an accident, for example, the insurance company would typically pay the actual cash value of the vehicle after determining its replacement cost and subtracting factors such as depreciation and wear and tear. Under replacement-cost coverage, the insurer would pay the amount required to replace the covered item with a like-kind new one."
26,Actuarial Age,"Actuarial age is an individual's life expectancy based on calculations and statistical modeling. Actuaries use mathematical and statistical computations to predict a person's life expectancy, or his or her actuarial age, to assist insurance companies with pricing, forecasting and planning. For instance, knowing a person's actuarial age will help determine the most appropriate payments from an annuity.",A person's actuarial age is the age to which mathematical and statistical modeling indicate a person will live. The actuarial age reflects factors such as health and serious medical conditions. Actuaries assess risk for insurance companies and use computerized predictive modeling to project probable outcomes for a wide variety of circumstances.
27,Actuarial Assumption,"An actuarial assumption is an estimate of an uncertain variable input into a financial model, normally for the purposes of calculating premiums or benefits. For example, a common actuarial assumption relates to predicting a person's lifespan, given their age, gender, health conditions and other factors. Actuaries use large tables of statistical data which correlate the uncertain variable to a variety of key predictive variables. Given the values for the predictive variables, a sound actuarial assumption can be made for the uncertain variable.","Anactuarial assumptionestimates of an unknown value based on themethods of actuarial science. An actuarial assumption is made using statistical tools, such as thecorrelationof known values to possible outcomes for the unknown value. Typically, the preparation of an actuarial assumption requirescomplex mathematical and statistical techniques."
28,Actuarial Equity,"Actuarial equity is the calculation of an insurance premium based on crucial factors such as the applicant's age, gender, health, family history and the type of insurance coverage applied for. This is soinsurers can to treat applicants fairly according to their estimated risk levels.","In automobile insurance, for example, insurers use age as a rating factor in determining individual premiums. Thus, because young people tend to have less favorable driving records as a group, these individuals are required to pay out more in premiums, which normally include the expected value of losses. Also known as risk-based pricing."
29,Actuarial Life Table,"An actuarial life table is a table or spreadsheet that shows the probability of a person at a certain age dying before his or her next birthday.These statistics calculate the remaining life expectancy for people at different ages and the probability of surviving a particular year of age. Because men and women have differing mortality rates, an actuarial life table is computedseparately for men and women.An actuarial life table is also called mortality table, life table or actuarial table.","Insurance companies utilize actuarial life tables to help price products and project future insured events. Mathematically and statistically based actuarial life tables assist insurance companies by showing event probabilities, such as death, sickness and disability. An actuarial life table can also include factors to differentiate variable risks such as smoking, occupation, socio-economic status and even gambling and debt load. Computerized predictive modeling allows actuaries the ability to calculate for a wide variety of circumstances and probable outcomes."
30,Actuarial Rate,"Actuarial rate is an estimate of the expected value of future loss. Usually, the future loss experience is predicted on the basis of historical loss experience and the consideration of the risk involved. Accurate actuarial rates help protect insurance companies against the risk of severe underwriting losses that could lead to insolvency.","Generally, during the rate review, it is first determined whether the actuarial rates need to be adjusted. A projected loss experience gives the insurance companies the ability to determine the minimum premium required to cover expected losses."
31,Actuarial Risk,"Actuarialrisks are the risks that the assumptions that actuaries implement into a model to price a specific insurance policy may turn out wrong or somewhat inaccurate.Possible assumptions include the frequency of losses, severity of losses and the correlation of losses between contracts. Actuarial risk is also known as ""insurance risk.""",The level of actuarial risk is directly proportional to the reliability ofassumptions implemented in pricing models used by insurance companies to set premiums.
