,term,definition,break_down
257,Cancellation Provision Clause,"A cancellation provision clause is a provision in an insurance policy that permits an insurer or an insurance company to cancel a property and casualty or a health insurance policy at any time before its expiration date. Life insurance policies do not contain cancellation clauses, and while health insurance policies contain cancellation clauses, the clause does not allow the insurer to cancel the policy.","Generally, a cancellation provision clause requires that whenever a party chooses to cancel the policy, that party must send a written notice to the other one. The insurance company is also obligated to refund any prepaid premium on a pro rata basis. For example, if the insured paid premium for three months and chose to cancel the policy at the end of the second month, the insurance company is required to calculate the premium that applies to the last month and refund it to the insured party."
258,Canine Liability Exclusion,Canine liability exclusion is a homeowners insurance policy endorsementthat prevents the insurer from being liable for injuries or property damage caused by a canine owned by the insured individual.Insurance endorsements are amendments in the form of modifications of or additions to the original policy.,"Canine liability exclusion may apply only to certain breeds of dogs that insurers consider to be more aggressive, and thus more likely to cause injury or property damages that result in claims."
259,Cape Cod Method,"Cape Cod method is used to calculate loss reserves, whichuseweights proportional to loss exposure and inversely proportional to loss development. The Cape Cod (CC) method operates under the assumption that premiums or other volume measures are known for historical accident years, and that ultimate loss ratios are identical for all accident years. The Cape Cod method is sometimes called the Stanard-Buhlmann method.","The Cape Cod method is based off of the framework created by the Bornhuetter-Ferguson method of loss development, which also serves as the framework for the chain-ladder method and additive method. The primary difference between the Cape Cod and Bornhuetter-Ferguson methods is that the Cape Cod method creates ultimate loss estimates using both internal and external information."
260,Capital At Risk (CaR),"Capital at risk (CaR) is the amount of capital that is set aside to coverrisks. CaRapplies to the self-insured, as well as insurance companies that underwrite insurance policies. It is used to pay losses. Similarly,an investor is required to have capital at risk in an investment in order to get certain tax treatments.","Insurance companies collect premiums for the policies that they underwrite. The amount of premium is determined based on the risk profile of the policyholder, the type of risk being covered, and the likelihood that a loss will be incurred after providing coverage. The insurance company uses this premium to fund its operations, as well as to earn investment income."
261,Capital Injection,"Capital injection is an investment of capital into a company or institution, generally in the form of cash, equity, and debt. The word ""injection"" connotes that the company or organization getting capital may be in financial distress, although it is not uncommon for the term to also refer to investments made in a startup or a new company.","Capital injections in the private sector are usually in exchange for an equity stake in the company that is receiving the funds. Capital injections can occur throughout the life cycle of a business. For example, at the establishment of a firm, it may open a seed round of cash investments from friends, family, and hand-selected angel investors. In return, the investors receive a portion of the company's ownership. If a private company in a growth phase wants to fund its momentum further, it canopen a series-A investment round, or it can take out debt, both of which are capital injections. If a mature company decides to go public, the money it earns through the issuance of shares is also a capital injection."
262,Capital Stock Insurance Companies,"A capital stock insurance company is a company that gets its capital from stockholdercontributions,in addition to its surplusand reserve accounts. In other words, a capital stock insurance company is one that gets a majority of its assets or money from the sale of shares or stock to stockholders.","All property andcasualtyinsurersperform the same basic function; however, some are organized as capital stock insurance companies while others operate as mutual companies. There are key differences between the two types of organizations. Each has advantages and disadvantages for insurance buyers."
263,Capitated Contract ,"A capitated contract is ahealthcare plan that allows payment of a flat fee for each patient it covers. Under a capitatedcontract, an HMO or managed care organization pays a fixed amount of money for its members to the health care provider. Capitatedcontractsare also referred to ascapitation agreements, capitation contracts and managed care capitated contracts.","Within a capitated contract, the healthcare provider is paid a set dollar amount per month to see patients regardless of how many treatments or the number of times the physician or clinic sees the patient. The agreement is that the provider will get a flat, prearranged payment in advance per month. Whether or not the patient needs services ina particular month, the provider will still get paid the same fee. The more treatment a patient needs, the less money a health provider makes per treatment."
264,Capitation Payments,"Capitation payments are paymentsagreed upon in a capitatedcontract by a health insurance company and a medical provider. They arefixed, pre-arranged monthly payments received by a physician, clinic or hospital per patient enrolled in a health plan, or per capita. Monthly payment is calculated one year in advance and remains fixed for that year, regardless of how often the patient needs services.","Capitation payments are defined, periodic, per-patient payments (usually monthly) for each individual enrolled in a capitated insurance plan. For example, a provider could be paid per-month, per-patient, despite how many times the patient comes in for treatment or how many services needed. The payment varies, depending on the capitation agreement, but generally they are based on characteristicssuch as the age of the individual enrolled in the plan. Modifying the plan, according to specific characteristics for groups of patients, is one way to compensate providers for the medical care expected for similar ailments within a group."
265,Captive Agent,"A captive agent is an insurance agent who only works for one insurance company. A captive agent is paid by that one company, either with a combination of salary and commissions or with just commissions. He or she may be a full-time employee or an independent contractor. Captive agents have in-depth knowledge of their particular company's insurance products, but cannot help a client who does not need or does not qualify for that company's products. The parent company may push its captive agents to sell certain policies or meet certain sales quotas.",
266,Captive Insurance Company,A captive insurance company is a wholly owned subsidiary company that provides risk-mitigation services for its parent company or a group of related companies. A captive insurance company may form if the parent company cannot find an outside firm to insurethem against particular business risks; if the premiums paid to the captive insurer creates tax savings; or if the insurance provided is more affordable or offers better coverage for the parent company's risks.,"Acaptive insurance company is a form of corporate ""self-insurance."" While there are financial benefits of creating a separate entity to provide insurance services, parent companies must consider the associated administrative and overhead costs, such as additional personnel. There are also complex compliance issues to consider. As a result, larger corporations predominantly form captive insurance companies."
267,Captive Value Added (CVA),Captive value-added refers to the financial benefits an organization could realize by creating a captive insurance company owned and operated by the parent organization.,"Captive value-added occurs when an organizations captive insurance subsidiary generates profits for the controlling organization. A primary purpose in creating a captive insurance company is to insure the risks of the owners, while benefiting the parent organization from the captive insurers underwriting profits."
268,"Care, Custody Or Control (CCC)","Care, custody and control is an exclusion found in liability insurance policies that removes indemnification for the insured when a property is placed in the care of the insured. The care, custody,or control (CCC) exclusion generally applies to property that is not owned by the insured, such as rental equipment or goods being transported.","Commercial general liability policies often contain a number of exclusions. Coverage typically applies to property that is owned by the insured party, or otherwise specifically listed in the insurance policy language. Other property, such as rented property, is often left uncovered by care, custodyor control exclusions."
269,Carmack Amendment,"The Carmack Amendment is a revision to the to the Interstate Commerce Act of 1877, which regulates the relationship between shipping companies and the owners of goods under shipment. The Carmack Amendment limits liabilities of these shipping companies, known as carriers, to loss or damage of the property itself. The Carmack Amendment, sometimes only referred to as Carmack, was enacted in 1906, and applies to insurance coverage for cargo.","Before the Carmack Amendment, companies involved in the transportation of goods across state borders were subject to state laws regulating the liabilities of shipping companies to their clients. The Carmack Amendment was an important step in the harmonization regulations applied to interstate shippers and interstate carriersfrom claims made by companies in excess of the value of the goods."
270,Carryover Provision,A carryover provision is an insurance policy clause that allows the policyholder to move claims from the end of one year to the beginning of the next year. Usually this provision only applies to losses sustained in the last three months of the year.,"Carryover provisions are commonly found in health insurance and related healthcare plans, and can be found inFlexible Spending Accounts (FSA) as well. The insured can benefit from having a carryover provision on apolicy if the policyholder incursa high number of claims in one year and have already met their deductible. This allows the policyholderto move additional claims that would have had no effect on this years deductible to next year to offset additional out of pocket costs. Carryover provisionsare most commonly found on employee-sponsored plans, but can sometimes be optioned on individual plans as well. However, the cost of the additional rider may prove to be too much for individuals to carry on their own."
271,Case Management,"Case management is the planning, processing and monitoring the healthcare services given to a patient by a coordinated group of healthcare providers. Case management is designed to provide for a patients needs while controllingcosts, with a case manager maintaining information on a patients outcomes. Insurance companies, hospitals, and outpatient care providers may all assign a case manager to monitor a particular patient.","A medical professional managing an individuals needs is not that different from a financial advisor managing a clients portfolio. Case managers evaluate a patients needs, and determine how to provide care efficiently given the resources at hand. Because case managers work for health insurance companies, hospitals, and other providers, they attempt to keep costs down as much as possible."
272,Cash Accumulation Method,Cash accumulation method refers to a common technique for comparing different cash value life insurance policies. It assumes that the death benefits for the policies are equal and unchanging. The aggregate difference between the premiums paid into the two policies is then evaluated over time.,"The cash accumulation method is used to rank policies according to their cost effectiveness. When comparing policies using this method, the one that has the most cash value at the end of the trial period is considered the better policy. This comparison requires that the premiums paid for each policy during the comparison period are equal. If they are not equal, then the difference between the two must be set aside, in order to make an apples-to-apples comparison."
273,Cash Flow Underwriting,Insurance companies may use cash flow underwriting as a pricing strategy when they price an insurance product below the rate of premium required to assume the cost of expected losses. The purpose of this strategy is to generate substantial investment capital from the increased business which comes from the lower pricing. Cash flow underwriting is a risky pricing strategy. ," Cash flow underwriting is a more common tactic in a softmarket when a weak economy makes potential insurance customers price sensitive. To stand out from the market competitionan insurance company may lower their premiums. However, at a particular point, thepremium will no longer cover the anticipated risk of underwriting the policy."
274,Cash Surrender Value,"The cash surrender value is the sum of money an insurance company pays to a policyholder or an annuity contract owner in the event that his or her policy is voluntarily terminated before its maturity or an insured event occurs. This cash value is the savings component of most permanent lifeinsurance policies, particularly whole life insurance policies. It is also known as ""cash value,"" ""surrender value,""and ""policyholder's equity.""","Cash surrender value applies to the savings element of whole life insurance policies payable before death. However, during the early years of a whole life insurance policy, the savings portion brings very little return compared to the premiums paid. Cash surrender value is the accumulated portion of a permanent life insurance policy's cash value that is available to the policyholder upon surrender of the policy. Depending on the age of the policy, the cash surrender value could be less than the actual cash value. In the early years of a policy, life insurance companies can deduct fees upon cash surrender. Depending on the type of policy, the cash value is available to the policyholder during his lifetime. It is important to note that surrendering a portion of the cash value reduces the death benefit."
275,Cash Value Accumulation Test (CVAT),Cash value accumulation test (CVAT) is a test for determining whether a financial product can be taxed as an insurance contract rather thanan investment.The cash value accumulation testis used to make sure that the cash value of the insurance policy does not exceed the present value of all future premium payments on the policy.,"Being able to pass the cash value accumulation test (CVAT) is incredibly important to a policyholder as well as the insurer. If an insurance product fails to pass, it is no longer considered an insurance productand is thus taxed like an investment. Insurance policies are able to grow in value on a tax-deferred basis, with death benefits being exempt from income tax. Most other investments are taxed as ordinary income, meaning that failing to pass the test will lead to a higher tax rate."
276,Cash Value Life Insurance,"Cash value life insurance is permanent life insurance with a cash value savings component. The policyholder can use the cash value for many purposes, such as a source of loans, as a source of cash, or to pay policy premiums.",
277,Casualty And Theft Losses,"Casualty and theft losses are deductiblelosses that arisefrom thedestruction or loss of a taxpayer's personal property. To be deductible, casualty losses must result from a sudden and unforeseen event. Theft losses generally require proof that the property was actually stolen and not just lost or missing.","Casualty and theft loss deductionsare only allowed by the Internal Revenue Servicefor one-off events that are out of the ordinaryand not a routine part of everyday life. The event also must be something that a person wasnot engaged with when it occurred. Natural disasters would qualify, including earthquakes, fires, floods, hurricanesand storms. Even though a loss may have been sustainedby a natural cause, a loss cannot be claimed for something that occurred over time. An example of this would be property erosion, because the process is gradual."
278,Casualty Insurance,"Casualty insurance is a broad category of coverage against loss of property, damage or other liabilities. Casualty insurance includes vehicle insurance, liability insurance, theft insurance and elevator insurance.","An important type of casualty insurance for businesses is workers' compensation insurance, which protects a company from liabilities that arise when a worker is injured on the job. Another important typeof casualty insurance isliability insurance.Liability lossesare losses that occur as a result of the insureds interactions with others or their property.For homeowners or car owners, it's important to have casualty insurance as damage can end up being a large expense."
279,Cat Spread,"A cat spread is a type of derivative traded on the Chicago Board of Trade (CBOT) that takes the form of an option on a catastrophe futures contract. In other words, a cat spread is basically a call option spread bought by insurance companies on catastrophe futures contracts. Purchasing a cat spread involves buying or selling a call option whose underlying asset is a catastrophe contract, while simultaneously selling or buying the same number of call options at a higher strike price. A cat spread is used by insurance companies to hedge risk coverage of catastrophic events.","Consider aninsurance company that buys a cat spread on a catastrophe futures contract with an expectation that the loss ratio on catastrophic events will fall within the range of 20to 40 percent. If losses fall within that range, the insurance company would exercise the option and sell the contract, enabling the company to make a profit which will be used to offset the losses. However, if the loss ratio does not fall within the 20to 40 percentrange, the option will expire at zero and the only thing the company has to lose is the original investment."
280,Catastrophe Accumulation,Catastrophe accumulation is a term used in the insurance industry that refers to the losses that an an insurer or reinsurer may face across a geographic area from a natural disaster.,"Catastrophe accumulation is calculated from a wide range of losses and involves partial loss to total loss across a potentially large number of policies. Normally, insurers and reinsurers absorb individual losses from claims relatively easily. The loss severity is typically low compared to the total value of all premiums. A natural disaster, however, can result in losses far exceeding total premiums. Because natural disasters are rare, it is easy for insurers and reinsurers to underestimate the losses that can occur, and thus require from the insured a lower premium than the risk actually warrants."
281,Catastrophe Equity Put (CatEPut),"A catastrophe equity put (CatEPut) is an option purchased by an insurer allowing it to sell its own stock at a certain price in the event insurance losses pass a specific threshold. In the event of a catastrophic event, CatEPuts can help insurance companies cover their increased claims.","Insurers plan on a certain number of claims to be made over the course of the year, and set aside money to ensure they can pay those claims. In some cases, so many claims are filed that the insurer may not have sufficient funds to cover its claims obligations. For example, in a year where several catastrophic hurricanes bring devastating flooding to the United States, an insurer that underwrites homeowners policies could face bankruptcy."
282,Catastrophe Excess Reinsurance,Catastrophe excess reinsurance protects catastrophe insurers from financial ruin in the event of a large-scale natural disaster.,"Catastrophe excess reinsurance protects insurance companies from the financial risks involved in large-scale catastrophic events. The size and unpredictability of catastrophes force insurers take on a tremendous amount of risk. Although catastrophic events happen infrequently, when they do happen they tend to cover wide geographic areas and cause large amounts of damage. When an insurer encounters a large number of claims all at once, the losses potentially could cause it to restrict new business or cause it to refuse to renew existing policies, limiting its ability to recover."
283,Catastrophe Futures,"Catastrophe futures are futures contracts traded on the Chicago Board of Trade (CBOT). These futures contracts are used by insurance companies to protect themselves against future catastrophe losses. The value of a catastophe futures contract is equal to $25,000 multiplied by the catastrophe ratio for the quarter. The catastrophe ratio is a numerical value provided by the CBOT every quarter.","Catastrophe futures started trading on the Chicago Board of Trading (CBOT) in 1992. The value of a catastrophe future contracts increase when catastrophe losses are high and decrease when catastrophe losses are low. In the event of a catastrophe, if losses are high, the value of the contract goes up and the insurer makes a gain that hopefully offsets whatever losses that might be incurred. The reverse is also true. If catastrophe losses are lower than expected, the value of the contract decreases and the insurer (buyer) loses money."
284,Catastrophe Insurance,"Catastrophe insuranceprotects businesses and residences against natural disasters such as earthquakes, floods and hurricanes, and against man-made disasters such as terrorist attacks. These low-probability, high-cost events are generally excluded from standard hazard insurance policies, which makescatastrophe insurance necessary.","Catastrophe insurance is different from other types of insurance in that it is difficult to estimate the total potential cost of an insured loss, and a catastrophic event results in an extremely large number of claims being filed at the same time. This makes it difficult for catastrophe insurance issuers to effectively manage risk. Reinsurance and retrocession are used along with catastrophe insurance to manage catastrophe risk."
285,Catastrophe Loss Index - CLI,"Catastrophe Loss Index - CLI, is anindex used in the insurance industry to quantify the magnitude of insurance claims expected from major disasters. They are created by third-party firms that research natural disasters and work to provide estimates of the amount of losses from each catastrophe. The catastrophe loss index (CLI) is often used by insurance companies to supplement, or check their internal efforts to estimate the company's expected claims from each catastrophe.","These indexes help with setting aside reserves for potential claims, as well as determining where or when to send out insurance adjusters to verify insurance claims. CLIs are also used as the underlying basis for a variety of derivative securities and catastrophe bonds. Securitization of catastrophic loss risks allows insurance companies to hedge against disasters, such as hurricanes, which might otherwise threaten to deplete an insurance company's reserves."
286,Catastrophe Reinsurance,Catastrophe reinsurance is purchased by an insurance company to reduce its exposure to the financial risks associated with a catastrophic event occurring.Catastrophe reinsurance allows the insurer to shift some or all of the risk associated with policies that it underwrites in exchange for a portion of the premiums that it receives from policyholders.,"Catastrophes are extremely rareevents, so buying catastrophe reinsurance is usually a carefully considered decision for an insurance company. Catastrophes arevery unlikely to occur with frequency, but when they do, the amount of damages they cause can be mind-boggling. Without reinsurance, claims made after a catastrophe would come from the insurers operating cash flow, from debt financing, or from liquidating assets. Insurers have to balance being prepared for a low probability event and taking on premiums from issuing policies that may result in claims."
